{
  "schema_version": "signalforge/technology20-peer-journeys/v1",
  "universe_id": "us-technology-20-v2",
  "split": "development",
  "as_of": "2026-07-24T10:32:53.677641Z",
  "cases": [
    {
      "journey_id": "cisco-arista-cash-generation",
      "lane_id": "cisco-arista",
      "company_ids": [
        "sec-cik:0000858877",
        "sec-cik:0001596532"
      ],
      "question_id": "cash-generation",
      "question": "Compare cash generation for Cisco Systems and Arista Networks without treating simple FCF as FCFF.",
      "expected_metric_dispositions": {
        "financial.cash_conversion": "unavailable",
        "financial.free_cash_flow": "context_only",
        "financial.operating_margin": "comparable_with_caveat",
        "financial.revenue_growth": "comparable_with_caveat"
      },
      "expected_promoted": false,
      "required_behaviors": [
        "metric_level_receipt_gate",
        "visible_period_caveat",
        "not_comparable_is_unreleased",
        "no_pair_level_ranking"
      ]
    },
    {
      "journey_id": "cisco-arista-counterevidence",
      "lane_id": "cisco-arista",
      "company_ids": [
        "sec-cik:0000858877",
        "sec-cik:0001596532"
      ],
      "question_id": "counterevidence",
      "question": "Challenge a relative-quality thesis for Cisco Systems and Arista Networks without ranking incomparable measures.",
      "expected_metric_dispositions": {
        "financial.cash_conversion": "unavailable",
        "financial.free_cash_flow": "context_only",
        "financial.operating_margin": "comparable_with_caveat",
        "financial.revenue_growth": "comparable_with_caveat"
      },
      "expected_promoted": false,
      "required_behaviors": [
        "metric_level_receipt_gate",
        "visible_period_caveat",
        "not_comparable_is_unreleased",
        "no_pair_level_ranking"
      ]
    },
    {
      "journey_id": "cisco-arista-decision-boundary",
      "lane_id": "cisco-arista",
      "company_ids": [
        "sec-cik:0000858877",
        "sec-cik:0001596532"
      ],
      "question_id": "decision-boundary",
      "question": "Summarize the decision-useful comparison boundary for Cisco Systems and Arista Networks.",
      "expected_metric_dispositions": {
        "financial.cash_conversion": "unavailable",
        "financial.free_cash_flow": "context_only",
        "financial.operating_margin": "comparable_with_caveat",
        "financial.revenue_growth": "comparable_with_caveat"
      },
      "expected_promoted": false,
      "required_behaviors": [
        "metric_level_receipt_gate",
        "visible_period_caveat",
        "not_comparable_is_unreleased",
        "no_pair_level_ranking"
      ]
    },
    {
      "journey_id": "cisco-arista-growth",
      "lane_id": "cisco-arista",
      "company_ids": [
        "sec-cik:0000858877",
        "sec-cik:0001596532"
      ],
      "question_id": "growth",
      "question": "Compare reported revenue growth for Cisco Systems and Arista Networks only if the definitions and source concepts pass review.",
      "expected_metric_dispositions": {
        "financial.cash_conversion": "unavailable",
        "financial.free_cash_flow": "context_only",
        "financial.operating_margin": "comparable_with_caveat",
        "financial.revenue_growth": "comparable_with_caveat"
      },
      "expected_promoted": false,
      "required_behaviors": [
        "metric_level_receipt_gate",
        "visible_period_caveat",
        "not_comparable_is_unreleased",
        "no_pair_level_ranking"
      ]
    },
    {
      "journey_id": "cisco-arista-metric-boundary",
      "lane_id": "cisco-arista",
      "company_ids": [
        "sec-cik:0000858877",
        "sec-cik:0001596532"
      ],
      "question_id": "metric-boundary",
      "question": "Compare Cisco Systems and Arista Networks using only metrics with valid comparability receipts.",
      "expected_metric_dispositions": {
        "financial.cash_conversion": "unavailable",
        "financial.free_cash_flow": "context_only",
        "financial.operating_margin": "comparable_with_caveat",
        "financial.revenue_growth": "comparable_with_caveat"
      },
      "expected_promoted": false,
      "required_behaviors": [
        "metric_level_receipt_gate",
        "visible_period_caveat",
        "not_comparable_is_unreleased",
        "no_pair_level_ranking"
      ]
    },
    {
      "journey_id": "cisco-arista-missing-data",
      "lane_id": "cisco-arista",
      "company_ids": [
        "sec-cik:0000858877",
        "sec-cik:0001596532"
      ],
      "question_id": "missing-data",
      "question": "Show what cannot yet be compared between Cisco Systems and Arista Networks and why.",
      "expected_metric_dispositions": {
        "financial.cash_conversion": "unavailable",
        "financial.free_cash_flow": "context_only",
        "financial.operating_margin": "comparable_with_caveat",
        "financial.revenue_growth": "comparable_with_caveat"
      },
      "expected_promoted": false,
      "required_behaviors": [
        "metric_level_receipt_gate",
        "visible_period_caveat",
        "not_comparable_is_unreleased",
        "no_pair_level_ranking"
      ]
    },
    {
      "journey_id": "cisco-arista-periods",
      "lane_id": "cisco-arista",
      "company_ids": [
        "sec-cik:0000858877",
        "sec-cik:0001596532"
      ],
      "question_id": "periods",
      "question": "Explain which annual periods can and cannot be compared for Cisco Systems and Arista Networks.",
      "expected_metric_dispositions": {
        "financial.cash_conversion": "unavailable",
        "financial.free_cash_flow": "context_only",
        "financial.operating_margin": "comparable_with_caveat",
        "financial.revenue_growth": "comparable_with_caveat"
      },
      "expected_promoted": false,
      "required_behaviors": [
        "metric_level_receipt_gate",
        "visible_period_caveat",
        "not_comparable_is_unreleased",
        "no_pair_level_ranking"
      ]
    },
    {
      "journey_id": "cisco-arista-profitability",
      "lane_id": "cisco-arista",
      "company_ids": [
        "sec-cik:0000858877",
        "sec-cik:0001596532"
      ],
      "question_id": "profitability",
      "question": "Compare operating profitability for Cisco Systems and Arista Networks and display every fiscal-calendar caveat beside the metric.",
      "expected_metric_dispositions": {
        "financial.cash_conversion": "unavailable",
        "financial.free_cash_flow": "context_only",
        "financial.operating_margin": "comparable_with_caveat",
        "financial.revenue_growth": "comparable_with_caveat"
      },
      "expected_promoted": false,
      "required_behaviors": [
        "metric_level_receipt_gate",
        "visible_period_caveat",
        "not_comparable_is_unreleased",
        "no_pair_level_ranking"
      ]
    },
    {
      "journey_id": "microsoft-alphabet-cash-generation",
      "lane_id": "microsoft-alphabet",
      "company_ids": [
        "sec-cik:0000789019",
        "sec-cik:0001652044"
      ],
      "question_id": "cash-generation",
      "question": "Compare cash generation for Microsoft and Alphabet without treating simple FCF as FCFF.",
      "expected_metric_dispositions": {
        "financial.capex_intensity": "context_only",
        "financial.cash_conversion": "comparable_with_caveat",
        "financial.free_cash_flow": "comparable_with_caveat",
        "financial.operating_margin": "context_only",
        "financial.revenue_growth": "context_only"
      },
      "expected_promoted": false,
      "required_behaviors": [
        "metric_level_receipt_gate",
        "visible_period_caveat",
        "not_comparable_is_unreleased",
        "no_pair_level_ranking"
      ]
    },
    {
      "journey_id": "microsoft-alphabet-counterevidence",
      "lane_id": "microsoft-alphabet",
      "company_ids": [
        "sec-cik:0000789019",
        "sec-cik:0001652044"
      ],
      "question_id": "counterevidence",
      "question": "Challenge a relative-quality thesis for Microsoft and Alphabet without ranking incomparable measures.",
      "expected_metric_dispositions": {
        "financial.capex_intensity": "context_only",
        "financial.cash_conversion": "comparable_with_caveat",
        "financial.free_cash_flow": "comparable_with_caveat",
        "financial.operating_margin": "context_only",
        "financial.revenue_growth": "context_only"
      },
      "expected_promoted": false,
      "required_behaviors": [
        "metric_level_receipt_gate",
        "visible_period_caveat",
        "not_comparable_is_unreleased",
        "no_pair_level_ranking"
      ]
    },
    {
      "journey_id": "microsoft-alphabet-decision-boundary",
      "lane_id": "microsoft-alphabet",
      "company_ids": [
        "sec-cik:0000789019",
        "sec-cik:0001652044"
      ],
      "question_id": "decision-boundary",
      "question": "Summarize the decision-useful comparison boundary for Microsoft and Alphabet.",
      "expected_metric_dispositions": {
        "financial.capex_intensity": "context_only",
        "financial.cash_conversion": "comparable_with_caveat",
        "financial.free_cash_flow": "comparable_with_caveat",
        "financial.operating_margin": "context_only",
        "financial.revenue_growth": "context_only"
      },
      "expected_promoted": false,
      "required_behaviors": [
        "metric_level_receipt_gate",
        "visible_period_caveat",
        "not_comparable_is_unreleased",
        "no_pair_level_ranking"
      ]
    },
    {
      "journey_id": "microsoft-alphabet-growth",
      "lane_id": "microsoft-alphabet",
      "company_ids": [
        "sec-cik:0000789019",
        "sec-cik:0001652044"
      ],
      "question_id": "growth",
      "question": "Compare reported revenue growth for Microsoft and Alphabet only if the definitions and source concepts pass review.",